[
    {
      "id": "22lr",
      "name": ".22 LR",
      "category": "Rimfire",
      "mm": "5.6",
      "in": ".22",
      "aliases": [".22", "22LR", "22 Long Rifle"]
    },
    {
      "id": "22short",
      "name": ".22 Short",
      "category": "Rimfire",
      "mm": "5.6",
      "in": ".22",
      "aliases": ["22 Short"]
    },
    {
      "id": "22wmr",
      "name": ".22 WMR",
      "category": "Rimfire",
      "mm": "5.6",
      "in": ".22",
      "aliases": [".22 Magnum", "22 Winchester Magnum Rimfire", ".22 Mag"]
    },
    {
      "id": "17hmr",
      "name": ".17 HMR",
      "category": "Rimfire",
      "mm": "4.5",
      "in": ".17",
      "aliases": ["17 Hornady Magnum Rimfire"]
    },
    {
      "id": "17wsm",
      "name": ".17 WSM",
      "category": "Rimfire",
      "mm": "4.5",
      "in": ".17",
      "aliases": ["17 Winchester Super Magnum"]
    },
    {
      "id": "32swl",
      "name": ".32 S&W Long",
      "category": "Handgun",
      "mm": "7.9",
      "in": ".312",
      "aliases": [".32 Long", ".32 S&W", "7.62x23"]
    },
    {
      "id": "9mm",
      "name": "9mm Luger",
      "category": "Handgun",
      "mm": "9",
      "in": ".355",
      "aliases": ["9x19mm", "9x19", "9mm Parabellum", "9mm NATO", "9 Para", "9mm Para"]
    },
    {
      "id": "9x18",
      "name": "9x18mm Makarov",
      "category": "Handgun",
      "mm": "9.2",
      "in": ".363",
      "aliases": ["9mm Makarov", "9x18 Mak"]
    },
    {
      "id": "380acp",
      "name": ".380 ACP",
      "category": "Handgun",
      "mm": "9",
      "in": ".355",
      "aliases": ["9mm Short", "9x17mm", "9mm Browning", "9mm Corto", ".380 Auto"]
    },
    {
      "id": "38special",
      "name": ".38 Special",
      "category": "Handgun",
      "mm": "9.1",
      "in": ".357",
      "aliases": [".38 Spl", "38 Spl", ".38 S&W Special"]
    },
    {
      "id": "357mag",
      "name": ".357 Magnum",
      "category": "Handgun",
      "mm": "9.1",
      "in": ".357",
      "aliases": [".357 Mag", "357 Mag"]
    },
    {
      "id": "40sw",
      "name": ".40 S&W",
      "category": "Handgun",
      "mm": "10",
      "in": ".40",
      "aliases": ["40 Smith & Wesson", "40 S&W"]
    },
    {
      "id": "45acp",
      "name": ".45 ACP",
      "category": "Handgun",
      "mm": "11.43",
      "in": ".451",
      "aliases": [".45 Auto", "45 Auto", "45 ACP", ".45 Automatic Colt Pistol"]
    },
    {
      "id": "10mm",
      "name": "10mm Auto",
      "category": "Handgun",
      "mm": "10",
      "in": ".40",
      "aliases": ["10mm Automatic", "10mm Auto", "10x25mm"]
    },
    {
      "id": "44mag",
      "name": ".44 Magnum",
      "category": "Handgun",
      "mm": "10.9",
      "in": ".429",
      "aliases": [".44 Mag", "44 Remington Magnum", "44 Mag"]
    },
    {
      "id": "454casull",
      "name": ".454 Casull",
      "category": "Handgun",
      "mm": "11.5",
      "in": ".454",
      "aliases": ["454 Casull"]
    },
    {
      "id": "500sw",
      "name": ".500 S&W Magnum",
      "category": "Handgun",
      "mm": "12.7",
      "in": ".50",
      "aliases": ["500 S&W", "500 Magnum", ".500 Mag"]
    },
    {
      "id": "22ppc",
      "name": ".22 PPC",
      "category": "Rifle",
      "mm": "5.7",
      "in": ".224",
      "aliases": ["22 PPC", "5.7x38"]
    },
    {
      "id": "222rem",
      "name": ".222 Remington",
      "category": "Rifle",
      "mm": "5.7",
      "in": ".224",
      "aliases": ["222", ".222", "5.7x43mm"]
    },
    {
      "id": "223rem",
      "name": ".223 Remington",
      "category": "Rifle",
      "mm": "5.56",
      "in": ".223",
      "aliases": ["5.56 NATO", "5.56x45mm", "223 Rem", "5.56", ".223"]
    },
    {
      "id": "32wsl",
      "name": ".32 Winchester Self-Loading",
      "category": "Rifle",
      "mm": "8.2",
      "in": ".321",
      "aliases": [".32SL", ".32SLR", ".32WSL"]
    },
    {
      "id": "243win",
      "name": ".243 Winchester",
      "category": "Rifle",
      "mm": "6.2",
      "in": ".243",
      "aliases": ["243 Win", ".243 Win", "243 Winchester"]
    },
    {
      "id": "6.5creedmoor",
      "name": "6.5 Creedmoor",
      "category": "Rifle",
      "mm": "6.5",
      "in": ".264",
      "aliases": ["6.5 CM", "6.5mm Creedmoor", "6.5 CRDMR"]
    },
    {
      "id": "6.5x55",
      "name": "6.5x55 Swedish",
      "category": "Rifle",
      "mm": "6.5",
      "in": ".264",
      "aliases": ["6.5x55mm", "6.5 Swedish", "6.5 Swede", "6.5x55 SE"]
    },
    {
      "id": "270win",
      "name": ".270 Winchester",
      "category": "Rifle",
      "mm": "7.04",
      "in": ".277",
      "aliases": ["270 Win", ".270 Win", "270 Winchester"]
    },
    {
      "id": "7mm-08",
      "name": "7mm-08 Remington",
      "category": "Rifle",
      "mm": "7",
      "in": ".284",
      "aliases": ["7mm-08 Rem", "7mm-08"]
    },
    {
      "id": "7mmrem",
      "name": "7mm Remington Magnum",
      "category": "Rifle",
      "mm": "7",
      "in": ".284",
      "aliases": ["7mm Rem Mag", "7mm RM", "7mm Mag"]
    },
    {
      "id": "308win",
      "name": ".308 Winchester",
      "category": "Rifle",
      "mm": "7.62",
      "in": ".308",
      "aliases": ["7.62 NATO", "7.62x51mm", "308 Win", ".308", "308"]
    },
    {
      "id": "30-06",
      "name": ".30-06 Springfield",
      "category": "Rifle",
      "mm": "7.62",
      "in": ".308",
      "aliases": ["30-06", ".30-06", "30-06 Sprg", "7.62x63mm"]
    },
    {
      "id": "300win",
      "name": ".300 Winchester Magnum",
      "category": "Rifle",
      "mm": "7.62",
      "in": ".308",
      "aliases": ["300 Win Mag", ".300 Win Mag", "300 WM"]
    },
    {
      "id": "300blk",
      "name": ".300 AAC Blackout",
      "category": "Rifle",
      "mm": "7.62",
      "in": ".308",
      "aliases": ["300 BLK", ".300 BLK", "7.62x35mm", "300 Blackout"]
    },
    {
      "id": "300wsm",
      "name": ".300 WSM",
      "category": "Rifle",
      "mm": "7.62",
      "in": ".308",
      "aliases": ["300 Winchester Short Magnum", ".300 Win Short Mag"]
    },
    {
      "id": "303british",
      "name": ".303 British",
      "category": "Rifle",
      "mm": "7.7",
      "in": ".303",
      "aliases": ["303 British", "7.7x56mmR"]
    },
    {
      "id": "338lapua",
      "name": ".338 Lapua Magnum",
      "category": "Rifle",
      "mm": "8.6",
      "in": ".338",
      "aliases": ["338 Lapua", ".338 LM", "8.6x70mm"]
    },
    {
      "id": "375hh",
      "name": ".375 H&H Magnum",
      "category": "Rifle",
      "mm": "9.5",
      "in": ".375",
      "aliases": ["375 H&H", ".375 Holland & Holland", "375 Holland & Holland"]
    },
    {
      "id": "416rigby",
      "name": ".416 Rigby",
      "category": "Rifle",
      "mm": "10.6",
      "in": ".416",
      "aliases": ["416 Rigby"]
    },
    {
      "id": "45-70",
      "name": ".45-70 Government",
      "category": "Rifle",
      "mm": "11.6",
      "in": ".458",
      "aliases": ["45-70 Govt", ".45-70", "45-70"]
    },
    {
      "id": "50bmg",
      "name": ".50 BMG",
      "category": "Rifle",
      "mm": "12.7",
      "in": ".50",
      "aliases": ["50 Browning Machine Gun", "12.7x99mm NATO", ".50 Cal"]
    },
    {
      "id": "762x39",
      "name": "7.62x39mm",
      "category": "Rifle",
      "mm": "7.62",
      "in": ".311",
      "aliases": ["7.62 Soviet", "7.62 Russian", "7.62x39"]
    },
    {
      "id": "545x39",
      "name": "5.45x39mm",
      "category": "Rifle",
      "mm": "5.45",
      "in": ".221",
      "aliases": ["5.45 Soviet", "5.45 Russian", "5.45x39"]
    },
    {
      "id": "762x54r",
      "name": "7.62x54mmR",
      "category": "Rifle",
      "mm": "7.62",
      "in": ".312",
      "aliases": ["7.62 Russian", "7.62x54R", "7.62x54 Rimmed"]
    },
    {
      "id": "12gauge",
      "name": "12 Gauge",
      "category": "Shotgun",
      "mm": "18.5",
      "in": ".729",
      "aliases": ["12 GA", "12ga", "12G"]
    },
    {
      "id": "20gauge",
      "name": "20 Gauge",
      "category": "Shotgun",
      "mm": "15.6",
      "in": ".615",
      "aliases": ["20 GA", "20ga", "20G"]
    },
    {
      "id": "410bore",
      "name": ".410 Bore",
      "category": "Shotgun",
      "mm": "10.4",
      "in": ".410",
      "aliases": ["410 GA", "410ga", ".410 Shotgun", "36 Gauge"]
    },
    {
      "id": "28gauge",
      "name": "28 Gauge",
      "category": "Shotgun",
      "mm": "13.9",
      "in": ".545",
      "aliases": ["28 GA", "28ga", "28G"]
    },
    {
      "id": "16gauge",
      "name": "16 Gauge",
      "category": "Shotgun",
      "mm": "16.8",
      "in": ".662",
      "aliases": ["16 GA", "16ga", "16G"]
    },
    {
      "id": "10gauge",
      "name": "10 Gauge",
      "category": "Shotgun",
      "mm": "19.7",
      "in": ".775",
      "aliases": ["10 GA", "10ga", "10G"]
    },
    {
      "id": "6.5prc",
      "name": "6.5 PRC",
      "category": "Rifle",
      "mm": "6.5",
      "in": ".264",
      "aliases": ["6.5mm Precision Rifle Cartridge", "6.5 Precision Rifle Cartridge"]
    },
    {
      "id": "6.5x47",
      "name": "6.5x47 Lapua",
      "category": "Rifle",
      "mm": "6.71",
      "in": ".264",
      "aliases": ["6.5x47", "6.5x47mm"]
    },
    {
      "id": "6.5grendel",
      "name": "6.5 Grendel",
      "category": "Rifle",
      "mm": "6.5",
      "in": ".264",
      "aliases": ["6.5mm Grendel"]
    },
    {
      "id": "6mmbr",
      "name": "6mm BR",
      "category": "Rifle",
      "mm": "6.2",
      "in": ".243",
      "aliases": ["6 Creedmoor", "6mm CM"]
    },
    {
      "id": "6mmcreedmoor",
      "name": "6mm Creedmoor",
      "category": "Rifle",
      "mm": "6",
      "in": ".243",
      "aliases": ["6mm BR"]
    },
    {
      "id": "224valkyrie",
      "name": ".224 Valkyrie",
      "category": "Rifle",
      "mm": "5.7",
      "in": ".224",
      "aliases": ["224 Valkyrie"]
    },
    {
      "id": "22-250",
      "name": ".22-250 Remington",
      "category": "Rifle",
      "mm": "5.7",